keyword,title,url,snippet,final_score,sentiment_score
"bitcoin","Strategy and bitcoin-buying firms face wider exclusion from stock indexes - Reuters","https://www.reuters.com/business/strategy-bitcoin-buying-firms-face-wider-exclusion-stock-indexes-2025-12-19/","Get a daily digest of breaking business news straight to your inbox with the Reuters Business newsletter. Sign up here.

Shares in Strategy, which began life as software firm MicroStrategy, skyrocketed 3,000% after it began buying bitcoin in 2020, although they have since fallen sharply, and are down about 43% this year amid the cryptocurrency's slump. [...] Purchase Licensing Rights

Elizabeth Howcroft reports on finance and technology, including Europe's ""fintech"" industry and cryptocurrencies. She was part of the team which won a Loeb award and SABEW award for covering the collapse of crypto exchange FTX in 2022.

EU Council backs digital euro with both online and offline functionality

Boards, Policy & Regulationcategory [...] US crypto industry cheers 2025 wins, but party may fizzle next year

Coinbase appoints UK ex-finance minister George Osborne to run advisory council

Focus: No small token: Chinese firms convert prized trees, tea into digital assets

### AI boom drives data-center dealmaking to record high, says report",58.48,-0.3
"bitcoin","Bitcoin Is Doing Something Last Seen in 2014. Wall Street Analysts Say This Will Happen in 2026. - Yahoo Finance","https://finance.yahoo.com/news/bitcoin-doing-something-last-seen-091500313.html","* Analysts at Standard Chartered and Bernstein expect Bitcoin to reach $150,000 in 2026, a forecast that implies 74% upside from its current price of $86,000. * More institutional investors are adding Bitcoin to their portfolios due to the improving regulatory environment and the simplicity of spot Bitcoin ETFs. The investment thesis for Bitcoin centers on the idea that demand will increase in the coming years as institutional investors diversify their portfolios and corporations integrate digital assets into their treasury strategies. Here's the big picture: A few Wall Street analysts have issued optimistic target prices for Bitcoin in 2026, and their reasoning largely centers on spot Bitcoin ETFs driving adoption among institutional investors. ## Should you buy stock in Bitcoin right now? Before you buy stock in Bitcoin, consider this:. The *Motley Fool Stock Advisor* analyst team just identified what they believe are the **10 best stocks** for investors to buy now… and Bitcoin wasn’t one of them.",65.6,0.3
"bitcoin","American Bitcoin buys additional 261 Bitcoin… holds 5044 BTC in total - bloomingbit","https://bloomingbit.io/en/feed/news/102479","# American Bitcoin buys additional 261 Bitcoin… holds 5044 BTC in total. * As a result, total **Bitcoin holdings have increased to 5044 BTC**. * The company is currently ranked **21st** in the global corporate Bitcoin holdings ranking. Bitcoin (BTC) mining company American Bitcoin Corporation (American Bitcoin Corp) has increased its Bitcoin holdings. On the 15th, Bitcoin Treasury said via X (formerly Twitter), ""American Bitcoin, backed by President Trump's family, recently purchased an additional 261 Bitcoin, bringing its total holdings to 5044 BTC."". Accordingly, the company rose to 21st place in the global corporate Bitcoin holdings ranking, the 'Bitcoin 100'. Blockchain journalist | Writer of Trade Now & Altcoin Now, must-read content for investors. What did you think of the article you just read? ### PiCK News. #### ""JP Morgan plans to launch tokenized money market fund on Ethereum…to inject $100 million in initial capital"". #### Token unlocks worth 300 million dollars expected this week… includes ARB, SOL, etc. ### Trending News.",50.8,0.1
"bitcoin","American Bitcoin's Bitcoin reserves have increased by approximately 623 BTC in the past 7 days, bringing its current holdings to 4941 BTC. - bitget.com","https://www.bitget.com/amp/news/detail/12560605109872","American Bitcoin's Bitcoin reserves have increased by approximately 623 BTC in the past 7 days, bringing its current holdings to 4941 BTC. # American Bitcoin's Bitcoin reserves have increased by approximately 623 BTC in the past 7 days, bringing its current holdings to 4941 BTC. Emmett Gallic, a blockchain analyst who previously disclosed and analyzed the ""1011 insider whale,"" posted on the X platform revealing updated data on the Bitcoin reserves of American Bitcoin, a crypto mining company supported by the Trump family. In the past seven days, they increased their holdings by about 623 BTC, of which approximately 80 BTC came from mining income and 542 BTC from strategic acquisitions in the open market. Ultiland: The new RWA unicorn is rewriting the on-chain narrative of art, IP, and assets. Crypto 2026 in the Eyes of a16z: These 17 Trends Will Reshape the Industry. Crypto 2026 in the Eyes of a16z: These 17 Trends Will Reshape the Industry.",50.8,0.1
"bitcoin","Hyperscale Data Bitcoin Treasury at 97.5% of Market Capitalization at Approximately $75.5 Million - Financial Times","https://markets.ft.com/data/announce/detail?dockey=600-202512160600PR_NEWS_USPRX____SF48387-1","### Hyperscale Data Bitcoin Treasury at 97.5% of Market Capitalization at Approximately $75.5 Million. ***Company Holds 498.4633 Bitcoin and has Allocated $31.5 Million of Cash for Future Purchases of Bitcoin***. (NYSE American: GPUS), an artificial intelligence (""**AI**"") data center company anchored by Bitcoin (""**Hyperscale Data**"" or the ""**Company**""), today announced that its Bitcoin treasury, including current holdings and cash allocated to committed purchases of Bitcoin, totaled approximately $75.5 million, based on the price of Bitcoin as of December 14, 2025. The Company remains committed to its long-term goal of accumulating Bitcoin equal to 100% of its market capitalization as part of its broader $100 milliondigital asset treasury (""**DAT**"") strategy. In addition, Hyperscale Data has allocated $31.5 million of cash for Sentinum to deploy into open-market Bitcoin purchases. ""Reaching 97.5% of the market capitalization is a significant milestone for the Company,"" stated Milton ""Todd"" Ault III, Executive Chairman of Hyperscale Data. Hyperscale Data will fully deploy the cash allocated to its DAT strategy into Bitcoin purchases over time.",63.48,0.2
"rare earth","Mesoporous high-entropy oxides enable metabolic fingerprinting for pancreatic cancer - Nature","https://www.nature.com/articles/s41578-025-00882-3","Provided by the Springer Nature SharedIt content-sharing initiative

Sign up for the Nature Briefing newsletter — what matters in science, free to your inbox daily.

Get the most important science stories of the day, free in your inbox. Sign up for Nature Briefing [...] Research Highlight

# Mesoporous high-entropy oxides enable metabolic fingerprinting for pancreatic cancer

Instant access to the full article PDF.

Prices may be subject to local taxes which are calculated during checkout",28.64,0
"rare earth","US raises Graphite One loan to $2.1B - Mining.com","https://www.mining.com/us-raises-graphite-one-loan-to-2-1b/","Henry Lazenby | December 19, 2025 | 7:43 am  Battery Metals Critical Minerals Canada USA Graphite [...] Copper $ 5.5267 / lb  1.83%",48,0
"rare earth","Iron as a sustainable energy carrier - Nature","https://www.nature.com/articles/s41578-025-00876-1","Provided by the Springer Nature SharedIt content-sharing initiative

Sign up for the Nature Briefing newsletter — what matters in science, free to your inbox daily.

Get the most important science stories of the day, free in your inbox. Sign up for Nature Briefing [...] View author publications

Correspondence to Laurine Choisez.

### Competing interests [...] CAS  PubMed  PubMed Central   Google Scholar

11. Peng, F. et al. Ignition and combustion of a single iron particle with impurities in hot post-flame gas flow. Combust. Flame 265, 113509 (2024).

12. Choisez, L. et al. Phase transformations and microstructure evolution during combustion of iron powder. Acta Mater. 239, 118261 (2022).",28.64,0
"rare earth","Is China Saving The Planet? Lessons From 2025’s Cleantech Race - Forbes","https://www.forbes.com/sites/elenabou/2025/12/19/is-china-saving-the-planet-lessons-from-2025s-cleantech-race/","Is China Saving The Planet? Lessons From 2025’s Cleantech Race

NurPhoto via Getty Images [...] In the first half of the year alone, China installed more solar panels than the rest of the world combined. And in August, the country set a new export record – $20 billion in cleantech shipments. Surging demand for electric vehicles and batteries drove much of that growth, but even in maturing segments like solar PV, China’s influence remained profound: it exported 46 GW of solar panels in a single month which is more than the entire installed capacity of Australia. [...] U.S Outpaces China In Battery Investment, Momentarily",66.4,0.45
"rare earth","Nike’s China conundrum deepens as turnaround stagnates - Reuters","https://www.reuters.com/business/retail-consumer/nikes-china-conundrum-deepens-turnaround-stagnates-2025-12-19/","Nike fails to contain margin bleed amid tariffs, turnaround, as shares fall

### Maersk completes first Red Sea voyage in nearly two years

Worldcategory · · ago [...] Our Standards: The Thomson Reuters Trust Principles., opens new tab

Thomson Reuters [...] Meanwhile, digital, seen as critical for growth, is sputtering, with online sales down 36% as competition from domestic brands like Anta and Li-Ning intensifies.

Direct-to-consumer traffic cooled both online and in stores. Zacks analyst David Bartosiak said the segment was a “problem child.”",63.48,-0.5
"rare earth","Gabon to audit mining deals as reforms start amid IMF talks - Mining.com","https://www.mining.com/web/gabon-to-audit-mining-deals-as-reforms-start-amid-imf-talks/","# Gabon to audit mining deals as reforms start amid IMF talks

Bloomberg News | December 19, 2025 | 10:51 am  Africa Manganese Oil & Gas [...] Copper $ 5.51 / lb  1.52%

Go to MDC Markets [...] Apart from oil, a vital part of the Gabonese economy is mining, which Nguema plans to leverage. Paris-based Eramet and China’s Industrial and Commercial Mining Company of Huazhou extract manganese in the country. Australia’s Apollo Minerals Ltd. is exploring for gold and zinc, while Fortescue Ltd. is developing an iron ore project in a joint venture with the government.",63,0.1
"rare earth","Erdene sees Mongolia gold mine anchoring future district - Mining.com","https://www.mining.com/erdene-sees-mongolia-gold-mine-anchoring-future-district/","Erdene sees Mongolia gold mine anchoring future district [...] Copper $ 5.5023 / lb  1.38%
Go to MDC Markets [...] “It’s been heads down, methodical exploration that’s allowed us to discover large copper-gold deposits in Mongolia,” he says. “It took a bit of time, but we’re at a point where I can say we found what we went looking for. We have production and there’s more to come.”

No comments found.

Graphite Creek is described by the US Geological Survey as the largest graphite deposit in the country.",43,0.1
"rare earth","ioneer expects partner search to conclude in H1 2026 - Mining.com","https://www.mining.com/ioneer-expects-partner-search-to-conclude-in-h1-2026/","# ioneer expects partner search to conclude in H1 2026 [...] Copper $ 5.5065 / lb  1.46%

Go to MDC Markets [...] These improvements increased average annual lithium production for years 1-25 from 19,200 tonnes to 24,500 tonnes LCE, while boosting average annual boric acid production from 116,400 tonnes to 135,500 tonnes, the company said in its update.

No comments found.

#### Goldman flags record gold, weak oil in 2026 commodity picks

The base case for gold is a rally to $4,900 an ounce, with risks to the upside, Goldman said.",58,0.1
"rare earth","Goldman flags record gold, weak oil in 2026 commodity picks - Mining.com","https://www.mining.com/web/goldman-flags-record-gold-weak-oil-in-2026-commodity-picks/","# Goldman flags record gold, weak oil in 2026 commodity picks [...] Copper $ 5.5253 / lb  1.80%

Go to MDC Markets [...] On Friday, Brent traded below $60 a barrel, set for a second weekly loss despite geopolitical tensions in Venezuela that have fanned concerns about possible interruptions to supplies. Gold was near $4,323 an ounce.

Among other forecasts, Goldman Sachs flagged lower natural-gas prices on the “largest ever wave” of supply; that copper would outperform aluminum; and weaker iron ore amid burgeoning mine production.

No comments found.",43,-0.1
"rare earth","Savannah nears full ownership of Barroso lithium lease - Mining.com","https://www.mining.com/savannah-nears-full-ownership-of-barroso-lithium-lease/","Staff Writer | December 19, 2025 | 5:40 am  Battery Metals Europe Lithium [...] Copper $ 5.5253 / lb  1.80%

Go to MDC Markets [...] Savannah plans to develop four open-pit mines capable of producing enough lithium each year to supply batteries for about 500,000 electric vehicles. Proença has said the project can break even at lithium prices of $600 a tonne, positioning the company to compete with larger producers while offering European customers shorter, more secure supply chains.",78,0.3
"rare earth","Press Release - Mining.com","https://www.mining.com/press-release?id=69450ba718e86fe8dc04441d","All samples were submitted to SGS Canada Inc. (“SGS”) in Burnaby, British Columbia, for preparation and analysis. Rock samples are being analyzed using a four-acid ICP package and fire assay for Au, Pt, and Pd, while soil samples are being analyzed using aqua regia digestion with fire assay for Au, Pt, and Pd where warranted. Fire assay with AA and gravimetric finishes remains the industry standard for gold and PGM determination, and SGS meets all analytical best-practice requirements. [...] As previously announced in the Company’s November 26, 2025, news release, the Company recently completed a comprehensive surface sampling program at the Brussels Creek Project. Subject to the receipt of pending assay results from this program, the NI 43-101 Technical Report is expected to be completed before the end of January 2026, representing a near-term technical milestone as the Company advances Brussels Creek toward its next phase of exploration. [...] Vanguard Mining Corp. is a Canadian mineral exploration company focused on the discovery and development of high-value strategic minerals. The Company is currently advancing exploration projects in Argentina, Canada, and Paraguay, with a focus on identifying and developing assets critical to the global energy transition. Vanguard is committed to responsible exploration and value creation through the acquisition and advancement of highly prospective uranium and precious-metal properties.",53,0.1
"rare earth","Govt. Approves INR 7,280 Crore Scheme to Promote Sintered Rare Earth Magnet Manufacturing - Energetica India Magazine","https://energetica-india.net/news/govt-approves-inr-7280-crore-scheme-to-promote-sintered-rare-earth-magnet-manufacturing","Approves INR 7,280 Crore Scheme to Promote Sintered Rare Earth Magnet Manufacturing. Approves INR 7,280 Crore Scheme to Promote Sintered Rare Earth Magnet Manufacturing. Government has approved INR 7,280 crore scheme to boost domestic manufacturing of sintered rare earth permanent magnets and strengthen India’s industrial and strategic supply chains. The Government has sanctioned a INR 7,280 crore scheme to develop a domestic manufacturing ecosystem for NdFeB (neodymium-iron-boron) rare earth permanent magnets (REPM) in India. The scheme aims to create a fully integrated value chain in India, from rare earth oxide (NdPr oxide) to metals, alloys, and finished magnets, to reduce dependence on imports and strengthen the country’s strategic and industrial capacities. IREL has a production capacity of 400 MTPA of NdPr oxide, sufficient to support about 1,200 MTPA of integrated NdFeB magnet production, and holds an additional stock of 500 metric tons of NdPr oxide, allowing India to support approximately 1,500 MTPA of REPM production. Rare earth magnets manufacturing India.",70.8,0.3
"rare earth","Rare Earth Permanent Magnets Manufacturing Incentive Scheme Announced by Ministry of Heavy Industries to Boost - CNBC TV18","https://www.cnbctv18.com/economy/centre-notifies-rs-7280-crore-scheme-to-boost-domestic-rare-earth-magnets-production-ws-l-19793166.htm","HomeEconomy NewsCentre notifies ₹7,280 crore scheme to boost domestic rare earth magnets production. # Centre notifies ₹7,280 crore scheme to boost domestic rare earth magnets production. ## India launches a ₹7,280 crore scheme to boost NdFeB magnet production, offering incentives and subsidies, with IREL supplying NdPr oxide for key sectors. The Ministry of Heavy Industries has notified a new ₹7,280 crore incentive scheme to promote domestic manufacturing of rare earth permanent magnets, a critical input for electric vehicles, wind turbines, electronics and defence equipment, as India looks to reduce its dependence on imports. Under the scheme, manufacturers of sintered NdFeB (neodymium-iron-boron) magnets will be eligible for sales-linked incentives up to ₹2,150 per kg. To qualify, companies will need to make a minimum investment of ₹300 crore to ₹600 crore, based on the capacity they plan to build. * 600 MTPA capacity: Minimum net worth of ₹180 crore. * 700 - 800 MTPA capacity: Minimum net worth of ₹245 crore.",70.8,0.25
"rare earth","Centre notifies rare earth magnet scheme - financialexpress.com","https://www.financialexpress.com/business/industry-centre-notifies-rare-earth-magnet-schemenbsp-4079137/","The scheme targets the creation of a domestic manufacturing capacity of 6,000 metric tonnes per annum (MTPA) of sintered Neodymium-Iron-Boron (NdFeB) magnets, a key input for sectors such as electronics, electric vehicles, aerospace and renewable energy. Manufacturers will be eligible for a sales-linked incentive capped at 40 per cent of their net sales turnover, along with a capital subsidy covering 15 per cent of eligible investments. Sales-linked incentives will be disbursed only after the commissioning of manufacturing capacity and will be capped in the range of ₹645 crore to ₹1,290 crore. The minimum expenditure towards eligible investment under the scheme has been set between ₹300 crore and ₹600 crore. A bidder applying for 600 TPA capacity must have a minimum net worth of ₹180 crore. For capacities of 700-800 TPA, the minimum net worth requirement is ₹245 crore, while bidders seeking 900-1,000 TPA capacity must have a net worth of at least ₹310 crore. For applications covering 1,100-1,200 TPA capacity, the minimum net worth requirement is ₹375 crore.",70.8,0.2
"rare earth","Best Rare Earth Stocks to Buy Now December 2025 - Zacks Investment Research","https://www.zacks.com/featured-articles/321/best-rare-earth-stocks","As global demand for clean energy and advanced electronics accelerates, rare earths stocks — companies mining or processing these crucial minerals — offer exposure to a fast-growing, strategically vital sector often overlooked by the mainstream market. Below, we spotlight some of the best rare earth stocks to consider now, based on Zacks Rank, Style Scores and underlying fundamentals:. Selections for Best Rare Earth Stocks are based on the current top ranking stocks based on Zacks Indicator Score and other Zacks style scores. “Rare earth” stocks refer to companies involved in the extraction, processing, refining, recycling or production of rare earth elements (REEs) — a group of around 17 metallic elements (like neodymium, praseodymium, dysprosium, terbium) that play pivotal roles in modern technologies such as electric vehicles, wind turbines, high-end magnets, defense applications and electronics. * Environmental / sustainability impact: supporting the clean-tech transition (e.g., wind turbines, EV motors rely on rare earth magnets), domestic supply chain de-risking, recycling of materials.",60.8,0.4
"rare earth","Rare earth element technologies developed at Mines licensed by Australian mining company - Mines Newsroom","https://www.minesnewsroom.com/news/rare-earth-element-technologies-developed-mines-licensed-australian-mining-company","Colorado School of Mines has entered an exclusive worldwide licensing agreement with Australian-headquartered mining company Bayan Mining and Minerals Limited and its U.S. subsidiary for a suite of four patented rare earth element processing technologies. The licensed technologies, developed by researchers in the Kroll Institute for Extractive Metallurgy (KIEM) at Mines, target higher rare earth element recovery and lower processing costs from bastnaesite-dominant ores, a valuable source of light rare earth elements (LREE) like cerium, lanthanum, neodymium and praseodymium, as well as less studied minerals like ancylite. Bayan is seeking to secure a strategic position at the forefront of rare earth processing innovation within the U.S., and this exclusive license agreement provides full rights to deploy, enhance and sub-license the Mines-developed technologies worldwide. “Mid-stream processing is the critical bridge between mining and manufacturing, where value is created and innovations in efficiency, cost reduction and environmental performance determine whether critical minerals can reliably support modern technologies and national priorities.”. Bayan Mining and Minerals Ltd operates in the mining industry, focusing on critical minerals, particularly rare earth elements (REE).",65.8,0.3
"rare earth","Why China’s Export Surge Won’t Last - The National Interest","https://nationalinterest.org/feature/why-chinas-export-surge-wont-last","*The Wall Street Journal* references the over $1 trillion export surplus during the first 11 months of 2025 and declares China’s “export dominance.” *The Financial Times* says that the milestone speaks to the nation’s “industrial strength.” *The New York Times* saw China’s success as a repudiation of President Donald Trump’s tariff strategy, as did *The Washington Post*. Certainly, China’s achievement deserves notice, not only for its size but also as testimony to how Beijing found ways to cope, at least so far, with America’s and to a lesser extent Europe’s growing hostility to Chinese trade. With China exporting $53 billion worth of goods in October, these ASEAN markets are already absorbing more Chinese products than the United States and Europe. Nor are these developing economies likely to passively accept Chinese exports at current levels for long, much less accept the growth that China needs to support its industrial expansion. India has become very vocal about the increase in Chinese product flows, which have far outpaced Indian sales in China.",55.8,-0.1
"rare earth","Nvidia Stock (NVDA) News Today: China H200 Export Deal, Blackwell/Rubin Outlook, and 2026 Price Targets (Dec. 14, 2025) - ts2.tech","https://ts2.tech/en/nvidia-stock-nvda-news-today-china-h200-export-deal-blackwell-rubin-outlook-and-2026-price-targets-dec-14-2025/","Nvidia Stock (NVDA) News Today: China H200 Export Deal, Blackwell/Rubin Outlook, and 2026 Price Targets (Dec. 14, 2025). Nvidia stock is navigating a fresh China export opening for its H200 AI chips, renewed “AI spend” jitters, and big 2026 expectations for Blackwell and Rubin. It’s geopolitics: President Donald Trump’s decision to allow Nvidia to export H200 AI processors to China under a framework that takes **25% of revenue** for the U.S. government—while still keeping Nvidia’s newest, most advanced chips (Blackwell and the forthcoming Rubin) out of reach. ### Dec. 8–9: Trump opens the door to H200 exports—with a 25% U.S. Reuters reported that the U.S. will allow exports of Nvidia’s **H200** (described as its “second-best” AI chip) to China, collecting a **25% fee** on those sales. 2. Nvidia Stock (NVDA) News Today: China H200 Export Deal, Blackwell/Rubin Outlook, and 2026 Price Targets (Dec. 14, 2025). ### Nvidia Stock (NVDA) News Today: China H200 Export Deal, Blackwell/Rubin Outlook, and 2026 Price Targets (Dec. 14, 2025).",70.8,0.2
"rare earth","China to boost exports, imports in 2026 to pursue 'sustainable' trade, official says - TradingView","https://www.tradingview.com/news/reuters.com,2025:newsml_P8N3WU04G:0-china-to-boost-exports-imports-in-2026-to-pursue-sustainable-trade-official-says/","# China to boost exports, imports in 2026 to pursue 'sustainable' trade, official says. RefinitivLess than 1 min read. China plans to expand exports and imports next year as part of efforts to promote ""sustainable"" trade, a senior economic official said on Saturday, state media reported. China's annual $1 trillion trade surplus is stirring tensions with global trade partners and drawing criticism from the International Monetary Fund and other observers who say its production-focused economic growth model is unsustainable. Click For Restrictions -  Login or create a forever free account to read this news. ## More news from Reuters.",45.8,-0.1
