keyword,title,url,snippet,final_score,sentiment_score
"tesla","Tesla Stock News and Forecasts for Dec. 14, 2025: Robotaxi Countdown, Sales Signals, and Wall Street Targets for TSLA - ts2.tech","https://ts2.tech/en/tesla-stock-news-and-forecasts-for-dec-14-2025-robotaxi-countdown-sales-signals-and-wall-street-targets-for-tsla/","# Tesla Stock News and Forecasts for Dec. 14, 2025: Robotaxi Countdown, Sales Signals, and Wall Street Targets for TSLA. For TSLA investors, China matters less as a weekly stock catalyst and more as a **margin + volume + competitive pressure** story: any sign Tesla is losing share or relying on deeper incentives tends to feed directly into the valuation debate. A key piece of Tesla stock news shaping sentiment into Dec. 14 is Morgan Stanley’s decision to downgrade TSLA to **Equal Weight** (from Overweight), even while raising its price target to **$425**. ## What to watch next for Tesla stock (TSLA) this week. 2. Tesla Stock News and Forecasts for Dec. 14, 2025: Robotaxi Countdown, Sales Signals, and Wall Street Targets for TSLA. ### Tesla Stock News and Forecasts for Dec. 14, 2025: Robotaxi Countdown, Sales Signals, and Wall Street Targets for TSLA.",70.8,-0.2
"tesla","Plugin Vehicles Pass 75 Million Cumulative Sales! - CleanTechnica","https://cleantechnica.com/2025/12/14/plugin-vehicles-pass-75-million-cumulative-sales/amp/","# Plugin Vehicles Pass 75 Million Cumulative Sales! Cumulative plugin vehicle sales have surpassed 75 million units. He points out that we were at 74.3 million cumulative plugin vehicle sales at the end of October 2025, and with 1.3 million plugin vehicles sold in China alone in November, that means we have surpassed 75 million. Our most recent global EV sales report showed that the world reached 2.1 million plugin vehicle registrations in October, a new record. Will it take 3 years to reach 150 million cumulative plugin vehicle sales? The Tesla Model 3 clearly ended up winning the long game and became the best selling electric vehicle in history once it passed up the Nissan LEAF’s cumulative sales. * Naturally, we also have to mention the new highest selling electric vehicle model of all time, the Tesla Model Y, which was the top selling vehicle model of any type for two years in a row.",65.8,0.6
"tesla","Used Tesla reliability: what TÜV and Consumer Reports say - Автомобильный портал 32CARS.RU","https://www.32cars.ru/en/posts/id6653-used-tesla-reliability-what-tuv-and-consumer-reports-say","Used Tesla reliability: what TÜV and Consumer Reports say. Used Tesla reliability: TÜV and Consumer Reports flag suspension wear, brake corrosion, lighting faults and build issues, plus tips for pre-purchase inspections. Europe tells a similar story: according to Germany’s TÜV, the Tesla Model Y showed defects in 17.3% of first inspections, while the Model 3 posted 13.1%.The issues tend to cluster in a few areas. Brakes are another recurring item: with heavy reliance on regenerative deceleration, the friction discs are engaged less often and can corrode—an EV quirk that demands periodic attention even when pads seem barely touched.Lighting faults also surface, including headlight failures, some of which were previously addressed via software updates. used Tesla reliability, Consumer Reports, TÜV, Model Y defects, Model 3 defects, suspension wear, upper control arms, brake corrosion, lighting faults, build quality, pre-purchase inspection. Used Tesla reliability: TÜV and Consumer Reports flag suspension wear, brake corrosion, lighting faults and build issues, plus tips for pre-purchase inspections.",55.8,-0.3
"tesla","This YouTuber's Cross-Country 'Self Driving' Road Trip Shows What You Shouldn't Do With A Tesla - SlashGear","https://www.slashgear.com/2048227/tesla-model-y-fsd-cross-country-drive-damage-cost-youtuber-justin-demaree/","This YouTuber's Cross-Country 'Self Driving' Road Trip Shows What You Shouldn't Do With A Tesla. # This YouTuber's Cross-Country 'Self Driving' Road Trip Shows What You Shouldn't Do With A Tesla. YouTuber Justin Demaree, known as the Bearded Tesla Guy, decided to test his Tesla Model Y's Full Self-Driving (FSD) system on a cross-country road trip — and it didn't take long for the trip to become rocky. Even Tesla itself warns that it's the driver's responsibility to stay alert and drive safely while operating an FSD car. ## Is Tesla's Full Self-Driving covered by any warranty? If that hadn't been the case, Tesla would likely not have covered any issues caused by using Full Self-Driving mode. It would probably be a very difficult task to get Tesla to cover any damage caused by purposefully running into a giant metal object at full speed as you test FSD's capabilities.",45.8,-0.4
"tesla","Volkswagen reveals self-driving rival to Tesla Cybercab - Torquecafe.com","https://torquecafe.com/volkswagen-news-gen-urban-tesla-cybercab-rival/","# Volkswagen reveals self-driving rival to Tesla Cybercab. Tesla revolutionised semi-autonomous driving technology with its so-called Full Self-Driving system, a more advanced version of which will soon end up in its fleet of Cybercab robotaxis in the US. Volkswagen has announced it’s currently in the next stage of testing its Gen.Urban self-driving research vehicle, having previously quietly rolled the car out for “intensive trials”. Now capable of driving itself on the streets of Wolfsburg where Volkswagen is headquartered, Gen.Urban remains the centre of a research project for now, however the German car giant is aiming to “explore how passengers experience riding in a self-driving vehicle without a traditional steering wheel or pedals”. “With our Gen.Urban research vehicle, we want to understand exactly how passengers experience autonomous driving. Like other self-driving cars such as Tesla’s Cybercab and even the fleet of Jaguar I-Pace-based Waymos in the US, Volkswagen says customers using Gen.Urban can make adjustments to the cabin temperature and ambient lighting prior to its arrival. ### Volkswagen reveals self-driving rival to Tesla Cybercab.",55.8,0.1
"tesla","China Approves First Level‑3 Self‑Driving Cars - StratNews Global","https://stratnewsglobal.com/china/china-approves-first-level-3-self-driving-cars/","The auto industry has defined five levels of autonomous driving, from cruise control at level one to fully self-driving cars at level five, and level three allows drivers to take their eyes and hands off the road in certain situations. On Monday, China’s industry regulator authorized two domestically made cars equipped with level-3 autonomous driving technology, marking the first time such vehicles have been officially approved for nationwide mass adoption. The auto industry has defined five levels of autonomous driving, from cruise control at level one to fully self-driving cars at level five, and level three allows drivers to take their eyes and hands off the road in certain situations. Last year, China lined up nine automakers for public tests to advance the adoption of self-driving cars. Autonomous driving developers such as Pony AI and WeRide have been testing their level-4 cars with licenses granted by local governments across China. Tesla’s Full Self-Driving, a level-2 driver assistance system, has been partially approved in China since February and falls short of its capabilities in the United States.",65.8,0.2
"tesla","California judge rules Tesla’s Autopilot, Full Self-Driving marketing deceptive; DMV threatens sales suspension - Storyboard18","https://www.storyboard18.com/how-it-works/california-judge-rules-teslas-autopilot-full-self-driving-marketing-deceptive-dmv-threatens-sales-suspension-86142.htm","* California judge rules Tesla’s Autopilot, Full Self-Driving marketing deceptive; DMV threatens sales suspension. # California judge rules Tesla’s Autopilot, Full Self-Driving marketing deceptive; DMV threatens sales suspension. A California administrative law judge has ruled that Tesla’s marketing of its “Autopilot” and “Full Self-Driving” systems was deceptive, and recommended a 30-day suspension of the company’s licenses to sell and manufacture vehicles in the state, according to the California Department of Motor Vehicles. In the proposed order, the judge wrote that a “reasonable consumer likely would believe that a vehicle with Full Self-Driving Capability can travel safely without a human driver’s constant, undivided attention,” a belief the judge said is incorrect both technologically and legally. However, Tesla is currently facing a class action lawsuit in California’s Northern District from drivers who allege the company misled them for years about the self-driving capabilities of its vehicles. ### California judge rules Tesla’s Autopilot, Full Self-Driving marketing deceptive; DMV threatens sales suspension.",75.8,-0.6
