keyword,title,url,snippet,final_score,sentiment_score
"rare earth","China puts anti-dumping tariff of up to 18.9% on imports of pork from the EU - Greenwich Time","https://www.greenwichtime.com/business/article/china-puts-anti-dumping-tariff-of-up-to-18-9-on-imports-of-pork-from-the-eu-21245262.php","China puts anti-dumping tariff of up to 18.9% on imports of pork from the EU. China will impose tariffs of up to 19.8% on pork imports from the European Union, a drastic drop from preliminary tariffs of up to 62.4%, its Commerce Ministry said Tuesday. The ministry's announcement followed an investigation the Chinese side launched into imports of pork from the trading bloc after the EU imposed provisional tariffs on China-made electric vehicles. In September, China ordered preliminary anti-dumping duties, in the form of security deposits, of 15.6% to 32.7% for pork imports from EU companies that collaborated with the anti-dumping investigation, and up to 62.4% for all others. EU exports of pork products to China peaked at 7.4 billion euros ($7.9 billion) in 2020 when Beijing turned to imports to meet domestic demand after its pig farms were devastated by a swine disease.",56.4,-0.1
"rare earth","ABx confirms rare earth heap leach potential - Mining.com.au","https://mining.com.au/abx-confirms-rare-earth-heap-leach-potential/","* ABx confirms rare earth heap leach potential. # ABx confirms rare earth heap leach potential. ABx Group (ASX:ABX) has reported preliminary results from two rare earth column leach tests conducted by the Australian Nuclear Science and Technology Organisation (ANSTO) on 26kg bulk samples. Following 17 days of testing, the first column test achieved 81% rare earths extraction, including 76% dysprosium and 79% terbium. Previous results from short-duration leaching tests of bulk samples from Deep Leads consistently achieved 65-75% extraction. The full column leach tests will be complete before the end of December and unloaded in early January, with the remaining solutions to be analysed for final rare earth recoveries, impurity levels, and to assess leaching kinetics. ABx Group is focused on delivering rare earths, bauxite, and industrial chemicals essential for a clean energy transition. Amy Rotman is a mining-focused editor and content strategist with extensive experience across industry media and investor engagement.",73,0.3
"rare earth","Neotech de-risks Hecla-Kilmer’s rare earth system - Mining.com.au","https://mining.com.au/neotech-de-risks-hecla-kilmers-rare-earth-system/","Neotech de-risks Hecla-Kilmer’s rare earth system. # Neotech de-risks Hecla-Kilmer’s rare earth system. Neotech Metals (CSE:NTMC) has received results from a comprehensive and independent mineralogical study on the Hecla-Kilmer Project in Canada, confirming up to 98% of total rare earth elements (TREEs) occur in apatite. The study, completed by SGS Lakefield, establishes Hecla-Kilmer as a fundamentally distinct rare earth system. Apatite occurs extensively across the sampled intervals and serves as the primary carrier of rare earths – an uncommon mineralisation style globally. CEO Reagan Glazier says Hecla-Kilmer continues to distinguish itself from every comparable rare earth system the company has studied. Neotech Metals is a mineral explorer focused on discovering and developing primarily rare earths in Canada. Now based in London as Mining.com.au’s Europe Correspondent, Aaliyah brings nearly three years of dedicated reporting in the mining news sector. We use cookies to ensure that we give you the best experience on our website.",68,0.25
"rare earth","Gadolyn Expands Advisory Board to Accelerate U.S. Manufacturing of Rare Earth Magnet Alloys - The Manila Times","https://www.manilatimes.net/2025/12/19/tmt-newswire/globenewswire/gadolyn-expands-advisory-board-to-accelerate-us-manufacturing-of-rare-earth-magnet-alloys/2246574","KINGSTON, Tenn., Dec. 18, 2025 (GLOBE NEWSWIRE) -- Gadolyn, Inc., an R&D 100 Award-winning company founded on DARPA-funded technology for sustainable rare earth magnet alloy manufacturing, today announced the appointments of Jack Lifton as Chair of its Advisory Board and Dr. Gareth Hatch as Member of the Advisory Board. Together, Mr. Lifton and Dr. Hatch bring more than 80 years of combined expertise in rare earths, magnets, critical material supply chains, and defense-related materials strategy, further strengthening Gadolyn’s leadership as it scales sustainable domestic capacity for rare earth alloy production and supports domestic and international initiatives for supply chain resilience. ""The company’s novel co-reduction platform enables feedstock-flexible, scalable alloy production that addresses one of the most critical choke points in Western supply chains: the ability to make finished rare earth magnet alloys cleanly, economically, and domestically.”. Gadolyn, Inc. is a 2025 R&D 100 Award-winning company whose DARPA-funded DIRECT technology produces rare earth magnet and strategic alloys directly from oxide feedstocks in a single co-reduction step, without toxic emissions or fluorinated byproducts.",65.8,0.5
"rare earth","Power Ministry lists 16 imported items to achieve self-sufficiency - BusinessLine","https://www.thehindubusinessline.com/companies/power-ministry-lists-16-imported-items-to-achieve-self-sufficiency/article70395093.ece","# Power Ministry lists 16 imported items to achieve self-sufficiency. ## These 16 very critical items include subsea cables, certain permanent magnets, aluminium zinc coated steel sheets, HVDC valve assemblies, modular type ethernet switches and lighting arrester. These 16 very critical items include subsea cables, certain permanent magnets, aluminium zinc coated steel sheets, HVDC valve assemblies, modular type ethernet switches and lighting arrester | Photo Credit:. The Power Ministry has identified 16 very critical items, such as subsea cables and certain specialised coated steel sheets, which are imported at present, to create a domestic manufacturing roadmap for achieving self-sufficiency. However, it has prioritised 16 items for “immediate attention” primarily due to their high import dependency and criticality for the power sector. These 16 very critical items include subsea cables, certain permanent magnets, aluminium zinc coated steel sheets, HVDC valve assemblies, modular type ethernet switches and lighting arrester. ### Comments. Users can access their older comments by logging into their accounts on Vuukle. * Access to comment on every story.",55.8,0.1
"rare earth","Lynas Rare Earths (ASX: LYC) Share Price After the Bell 12 Dec 2025: What Investors Need to Know Before the Next Market Open - ts2.tech","https://ts2.tech/en/lynas-rare-earths-asx-lyc-share-price-after-the-bell-12-dec-2025-what-investors-need-to-know-before-the-next-market-open/","# Lynas Rare Earths (ASX: LYC) Share Price After the Bell 12 Dec 2025: What Investors Need to Know Before the Next Market Open. **(SEO):** Lynas Rare Earths (ASX: LYC) closed at A$12.85 on 12 Dec 2025 after a volatile session. Lynas Rare Earths Limited (ASX: LYC) ended Friday, **12 December 2025**, with a deceptively simple headline: the stock finished **up 1.50% at A$12.85**. Market Index’s 12 Dec “Evening Wrap” included a broker moves section listing **Lynas Rare Earths (LYC)** as:. 1. Lynas Rare Earths (ASX: LYC) Share Price After the Bell 12 Dec 2025: What Investors Need to Know Before the Next Market Open. 2. Wesfarmers (ASX:WES) share price after the bell Dec. 12, 2025: WES slips to A$80.62 — key news, forecasts, and what to watch before the next market open. ### Lynas Rare Earths (ASX: LYC) Share Price After the Bell 12 Dec 2025: What Investors Need to Know Before the Next Market Open.",50.8,0.1
"rare earth","Lynas Rare Earths (ASX:LYC) Stock Update: Weekly Slide, Fresh Headlines, Analyst Forecasts, and What to Watch Next Week (Updated 14 Dec 2025)","https://ts2.tech/en/lynas-rare-earths-asxlyc-stock-update-weekly-slide-fresh-headlines-analyst-forecasts-and-what-to-watch-next-week-updated-14-dec-2025/","Lynas Rare Earths (ASX:LYC) ended the latest trading week with a small rebound on Friday—but the bigger story is the pullback that’s developed across early December as investors debate a familiar tug‑of‑war: **strategic tailwinds for non‑China rare earth supply** versus **valuation, price-cycle, and execution risks**. * **Headline catalysts:** Lynas’ **S&P/ASX 50 promotion** (effective **Dec 22**) is a structural positive, but near-term sentiment has been pressured by **valuation pushback** (Morningstar fair value commentary) and ongoing debate about **mid‑cycle NdPr prices**. 2. Lynas Rare Earths (ASX:LYC) Stock Update: Weekly Slide, Fresh Headlines, Analyst Forecasts, and What to Watch Next Week (Updated 14 Dec 2025). ### Lynas Rare Earths (ASX:LYC) Stock Update: Weekly Slide, Fresh Headlines, Analyst Forecasts, and What to Watch Next Week (Updated 14 Dec 2025).",65.8,-0.2
"rare earth","How Japan built a rare earth supply chain without China - The Straits Times","https://www.straitstimes.com/business/how-japan-built-a-rare-earth-supply-chain-without-china","# How Japan built a rare earth supply chain without China. Sign up now: Get ST's newsletters delivered to your inbox. Australian mining company Lynas’ facility in Kuantan, Malaysia, is one of the few large-scale rare earth separation plants operating outside China. * After China's 2010 rare earth embargo, Japan invested over $1 billion to diversify its supply chain away from China and reduce its vulnerability. * Japan supported Lynas, an Australian miner, with loans and equity, establishing a non-Chinese rare earth supply chain from Australia to Malaysia to Japan. * Despite bolstering supply chain resilience, with China now accounting for 60-70% of imports, Japan seeks international cooperation to reduce costs and dependency. Published Dec 14, 2025, 11:00 AM. Updated Dec 14, 2025, 11:37 AM. Tokyo has since quietly stitched together a supply chain that is considerably less dependent on China. Get unlimited access to exclusive stories and incisive insights from the ST newsroom.",70.8,0.2
"tesla","The 5 key moments that turned around Tesla's year and pushed it back to record highs - Business Insider","https://www.businessinsider.com/tesla-stock-price-year-in-review-recap-share-rebound-2025-2025-12","After a post-election Trump bump in late 2024, the company endured a difficult first quarter. Shares were nearly cut in half as CEO Elon Musk pivoted to government work by spearheading DOGE, and as sales fell globally. It was a grim time for shareholders.

But the company was able to turn things around, and currently sits just below record highs. The chart below, and the accompanying sections, trace the timeline of Tesla's stock resurgence.

Follow Joe Ciolli [...] Tesla stock has been on a wild ride this year, collapsing in the first quarter before rallying back to highs.

The company has benefited from its affiliation with the roaring AI trade.

Detailed below are five key events that helped turn around Tesla's fortunes in the stock market.

2025 has been a good year for comebacks. [...] The December rate cut may have come and gone as a relative formality, which makes it easy to forget that it was still in jeopardy as recently as mid-November. Then, New York Fed President John Williams sealed the deal with some commentary on Nov. 21. Tesla rallied sharply alongside the broader market, soaring 10% over the next week.

It's been mostly a straight shot higher to records since then.",60.28,0.3
"tesla","Musk wins appeal that restores 2018 Tesla pay deal now worth about $155 billion - Reuters","https://www.reuters.com/sustainability/boards-policy-regulation/musk-wins-appeal-restores-2018-tesla-pay-deal-worth-56-billion-2025-12-19/","Tesla has taken steps to reduce the risk that a shareholder could tie up the 2025 package in the courts.

The Austin-based company is now incorporated in Texas, which allows Tesla to require that any investor or group of investors must own 3% of the company stock before suing for an alleged corporate law violation. A stake of that size would be worth around $30 billion and Musk is the only individual with that much stock. [...] WILMINGTON, Delaware, Dec 19 (Reuters) - Elon Musk's 2018 pay package from Tesla (TSLA.O), opens new tab, once worth $56 billion, was restored by the Delaware Supreme Court on Friday, two years after a lower court struck down the compensation deal as ""unfathomable.""

The ruling overturns a decision that had prompted a furious backlash from Musk and damaged Delaware's business-friendly reputation.

Sign uphere. [...] Tesla's board had warned that Musk, the world's richest person who also leads the SpaceX rocket venture and artificial intelligence startup xAI, could leave the electric car company if he did not get the pay he wanted and an increase in his voting power.

In November, shareholders approved a new pay package that could be worth $878 billion if Tesla meets targets for self-driving vehicles, a robotaxi network and sales of humanoid robots.",78.48,0.2
"tesla","Tesla Wins Final Court Fight Over Elon Musk’s Pay Package - The Wall Street Journal","https://www.wsj.com/business/autos/tesla-wins-final-court-fight-over-elon-musks-pay-package-7292f747?gaa_at=eafs&gaa_n=AWEtsqeFR46YQA2os8-q9eCfZtlcS0-ZW7Y5dgIg0kp9zSiJtx0RLwtFrEjM&gaa_ts=6945cd03&gaa_sig=GUu88O2DwYykc8zpt3_gCJMMTalKgHwER9OrlinMuT8_AZbySrQvi0MQEZbdfyG4u_LIZTsyqrSByfkgnkQWyQ%3D%3D","Tesla TSLA -0.45%decrease; red down pointing triangle won its fight over a record-breaking pay package for Chief Executive Elon Musk that was approved by shareholders in 2018.

An opinion from the Delaware Supreme Court issued Friday ends the yearslong legal battle over compensation that grew in value to total more than $126 billion.

### Tesla’s stock finally clinches a milestone almost a year in the making

Shares saw their first record close since December 2024, helping support the continued reign of the “Magnificent Seven.”

### Pizza Hut Mogul’s Palatial Indiana Home—With a Lake and a House-Sized Primary Bedroom—Sells for $6.75M [...] An administrative judge found that the automaker deceived consumers by falsely implying its cars could drive on their own.

### Trump Defends Handling of Economy, Announces Military Dividend

The president said active-duty servicemembers would receive a $1,776 “warrior dividend” funded with tariff revenue.

### Warner Demands Larry Ellison’s Personal Guarantee in Paramount Bid",73.48,0.1
"tesla","Italy ends probes on Stellantis, Volkswagen, Tesla, BYD over EV consumer info - Reuters","https://www.reuters.com/sustainability/boards-policy-regulation/italy-ends-probes-stellantis-volkswagen-tesla-byd-over-ev-consumer-info-2025-12-19/","MILAN, Dec 19 (Reuters) - Italy's competition authority said on Friday it had closed probes of BYD (002594.SZ), opens new tab, Stellantis , Tesla (TSLA.O), opens new tab and Volkswagen for allegedly misleading consumers on the performance of their electric vehicles. [...] The investigations for possible unfair commercial practices, launched in February, had focused on information given by the automakers on EV driving range, battery capacity degradation and on limitations to warranty cover for batteries.

Make sense of the latest ESG trends affecting companies and governments with the Reuters Sustainable Switch newsletter. Sign up here.

Staff calls off strike at Paris Louvre museum for now - union

German economic recovery to get a subdued start next year, Bundesbank says",53.48,0
"tesla","Elon Musk’s $56B Tesla pay package restored by Delaware Supreme Court - TechCrunch","https://techcrunch.com/2025/12/19/elon-musks-56b-tesla-pay-package-restored-by-delaware-supreme-court/","Sean O’Kane is a reporter who has spent a decade covering the rapidly-evolving business and technology of the transportation industry, including Tesla and the many startups chasing Elon Musk. Most recently, he was a reporter at Bloomberg News where he helped break stories about some of the most notorious EV SPAC flops. He previously worked at The Verge, where he also covered consumer technology, hosted many short- and long-form videos, performed product and editorial photography, and once [...] The state supreme court’s decision draws to a close a years-long battle that left such a bad taste in Musk’s mouth that he moved its incorporation out of Delaware to Texas, which prompted other companies to follow suit. [...] Tesla will now likely revoke a $29 billion pay package it offered Musk earlier this year, which was meant as a hedge against the possibility that they would lose the Delaware Supreme Court appeal. The $1 trillion compensation package awarded to Musk in November is separate from that, and will continue to exist going forward, giving Musk a series of lofty goals to hit in order to unlock the full value.",83,0.05
"tesla","This power generator stock has struggled recently. Wells Fargo thinks there’s a buying opportunity - CNBC","https://www.cnbc.com/2025/12/19/this-power-generator-stock-has-struggled-recently-wells-fargo-thinks-theres-a-buying-opportunity.html","Here are Friday's biggest analyst calls: Nvidia, Oracle, Apple, Tesla, Nike, FedEx, Generac, CoreWeave & more

Stay away from Lyft as autonomous vehicles disrupt ridesharing market, says Wedbush

The AI boom comes to memory chips. What analysts are saying after Micron's blowout quarter",26.4,0
"tesla","What does TikTok's deal mean for America's users? - BBC","https://www.bbc.com/news/videos/c5yje8pvg8jo","## Watch: What's happening with Trump's Tesla parked at White House?

The US president is considering selling his Tesla car - which he says he purchased when he was trying to help Musk promote his company.

## Fans queue overnight for the launch of the Nintendo Switch 2

Nintendo's long-awaited Switch 2 has been released worldwide.

## How Karen Dunbar helped craft her Bafta-winning video game character [...] He made the gesture while thanking supporters for contributing to Trump's victory.

## Musk promises self-driving Tesla taxis, but are they safe?

BBC Tech Correspondent Lily Jamali analyses the 'robocabs' and if their technology is up to par.

## Watch: Can BBC reporter's AI clone fool his colleagues?

Cyber Correspondent Joe Tidy has an AI clone of himself built to see how sophisticated they can be.",52.04,-0.1
"tesla","Volkswagen Halts Exports of Its Electric Bus to U.S. Next Year - The Wall Street Journal","https://www.wsj.com/business/autos/volkswagen-halts-imports-of-its-electric-bus-to-u-s-next-year-acae1626?gaa_at=eafs&gaa_n=AWEtsqfnMV7MJuDM1zdrE8NaVnB23jWQ6betmQAIvJLzgxHmXRLi7pZwtJHR&gaa_ts=6945ebc8&gaa_sig=dVnPIJzyTClts7sRPboER7DNprYFYkQaFTvOptQJ3Kuqqni38dsL26IaxxXN5OTgC1kqESD_yffJTelTlne-xg%3D%3D","Find insight on barges operating on the Mississippi River, General Motors and more in the latest Market Talks covering Auto and Transport.

### Ford Takes $19.5 Billion Hit in Detroit’s Biggest EV Bust

The sum marks the U.S. auto industry’s biggest reckoning to date that it can’t realize its EV ambitions anytime soon.

### This chart captures Tesla’s EV sales woes — and things are about to get worse [...] What to Read Next

Use Alt + Down Arrow to expand.

Find insight on new-vehicle sales in 2026, General Motors and more in the latest Market Talks covering the auto and transport sector.",63.48,-0.4
"tesla","Why Did Micron Stock Jump 10% Yesterday? - Forbes","https://www.forbes.com/sites/greatspeculations/2025/12/19/why-did-micron-stock-jump-10-yesterday/","Can Trigger Tesla Stock’s Slide? [...] Multiple analysts have raised their price targets, with some reaching as high as $350.

The stock is predominantly owned by institutional investors, who account for approximately 80% of the shares.

The stock gapped up and traded to a high of $263.65, just below its recent record high of $264.75, indicating a test of a significant resistance level.

Understanding trade mechanics, money flow, and price behavior can provide you with an edge. See more. [...] Trading volume soared to 63.9 million shares, marking a 139% increase over the three-month average.

Total options volume reached 5x the normal amount, with 260,000 calls and 213,000 puts exchanged.

The 50-day put/call volume ratio is higher than 99% of readings from the previous year, indicating a recent increase in put buying, possibly for protection.

How Is The Money Flowing?

### Warning: Amazon Confirms 5-Year-Long Russian Cyberattack",46.4,0.1
"tesla","Ford to recall over 272,000 US vehicles due to loss of park function - Reuters","https://www.reuters.com/business/autos-transportation/ford-recall-over-272000-us-vehicles-due-loss-park-function-2025-12-19/","Toyota aims to begin selling 3 US-made models in Japan from 2026

Europe's auto industry future may be electric even after EU climbdown

Businesscategory · · 5 mins ago [...] Autos & TransportationcategoryWanxiang to pay $53 million to resolve US probe into imported Chinese auto parts, DOJ says

BusinesscategoryChina's ByteDance agrees deal to hand control of TikTok US app to new joint venture [...] [1/2]A model of the all-new Ford F-150 Lightning electric pickup is parked in front of the Ford Motor Company World Headquarters in Dearborn, Michigan, U.S. April 26, 2022. REUTERS/Rebecca Cook Purchase Licensing Rights, opens new tab",28.48,0
"tesla","Tesla (TSLA) Stock: The Self-Driving Update That Changes Everything for Investors - CoinCentral","https://coincentral.com/tesla-tsla-stock-the-self-driving-update-that-changes-everything-for-investors/","# Tesla (TSLA) Stock: The Self-Driving Update That Changes Everything for Investors. Tesla stock climbs as FSD version 14 shows improved performance and company begins testing driverless Model Y robotaxis in Austin without safety monitors. * Tesla’s Full Self-Driving version 14 shows smoother operation and improved capability compared to earlier versions. * Tesla started testing driverless Model Y robotaxis in Austin without human safety monitors on board. The release of FSD version 14 comes as Tesla begins testing completely driverless robotaxis in Austin, marking a turning point for the company’s autonomous vehicle ambitions. > A driverless Tesla Robotaxi was spotted on the roads of Austin, Texas today. Tesla has begun operating Model Y robotaxis in Austin without human safety monitors inside. The driverless tests represent a separate track from Tesla’s paying robotaxi service. Seven crash incidents involving Tesla’s supervised robotaxis were reported to NHTSA since the Austin service began. Tesla reported the testing progress as FSD version 14 continues rolling out to more vehicles in its fleet.",65.8,0.4
"tesla","Tesla - Fox News","https://www.foxnews.com/category/auto/make/tesla?page=46","# Tesla. Tesla is one of the world's leading manufacturers and designers of electric cars and trucks. Tesla's success has helped earn its leading executive, Elon Musk, a large fortune as one of the wealthiest individuals in the world. The Model 3 sedan, released in 2017, became the bestselling electric car in the world with more than 1 million sold and helped make Tesla a dominant safe energy company. #### Ford backs off Tesla Cybertruck tug-of-war rematch challenge, but Musk is doing it anyway. #### Ford executive challenges Tesla Cybertruck to pickup tug of war. #### Elon Musk explains Tesla Cybertruck window fail, says 200K have been ordered already. #### 7 funky features on Tesla's Cybertruck. #### Want to give Tesla's electric pickup truck a spin? #### Is this what Tesla's Cybertruck electric pickup looks like? #### Does puzzling Tesla Cybertruck logo reveal the electric pickup's design? #### Is this what Tesla's 'Cybertruck' pickup will look like?",55.8,0.1
"tesla","Tesla Stock Forecast: TSLA Weekly Recap, Latest News, and Week-Ahead Catalysts (Updated Dec. 13, 2025)","https://ts2.tech/en/tesla-stock-forecast-tsla-weekly-recap-latest-news-and-week-ahead-catalysts-updated-dec-13-2025/","# Tesla Stock Forecast: TSLA Weekly Recap, Latest News, and Week-Ahead Catalysts (Updated Dec. 13, 2025). Below is what moved Tesla stock this week, what matters for the week ahead (**Dec. 15–19**), and how major analysts are framing the risk/reward right now. ## Tesla stock this week: price action in one sentence. Investor’s Business Daily reported Tesla stock strengthened as investors reacted to Elon Musk reiterating that Tesla aims to **remove “safety monitors”** from **Model Y robotaxis in Austin** within weeks (a move toward fully driverless operation, at least in a limited rollout). ## Week ahead: Tesla stock catalysts to watch (Dec. 15–19, 2025). * The **week ahead** is likely to be driven as much by **macro data (CPI, retail sales)** and **options-driven volatility** as by Tesla-specific announcements. 1. Tesla Stock Forecast: TSLA Weekly Recap, Latest News, and Week-Ahead Catalysts (Updated Dec. 13, 2025).",65.8,0.2
